id_plan,id_usuario,tipo,plan_duracion,instructions,objectivo
1a257404-2741-4d5b-aae3-90f1e49b0471,62ae8127-7584-4fee-9ba1-a9fb77b22111,media-maraton,1.63,"""Lorem ipsum dolor sit amet consectetuer adipiscing elit. Proin risus. Praesent lectus.""","""Maecenas leo odio, condimentum id, luctus nec, molestie sed, justo. Pellentesque viverra pede ac diam. Cras pellentesque volutpat dui."""
296f1010-fd8b-4feb-a7dc-64d429099a65,bf91106f-2604-41a0-9340-79033a11b2d5,hiit,1.73,"""Nulla ut erat id mauris vulputate elementum. Nullam varius. Nulla facilisi.

Cras non velit nec nisi vulputate nonummy. Maecenas tincidunt lacus at velit. Vivamus vel nulla eget eros elementum pellentesque.""","""Duis bibendum. Morbi non quam nec dui luctus rutrum. Nulla tellus."""
d3c2f38b-249f-40c1-8230-d0ee763aa16e,5c8d1f57-d9d6-4e0c-83ab-1bded80e660a,condicionamiento,1.3,"""Proin leo odio porttitor id consequat in consequat ut nulla. Sed accumsan felis. Ut at dolor quis odio consequat varius.

Integer ac leo. Pellentesque ultrices mattis odio. Donec vitae nisi.""","""Donec diam neque, vestibulum eget, vulputate ut, ultrices vel, augue. Vestibulum ante ipsum primis in faucibus orci luctus et ultrices posuere cubilia Curae; Donec pharetra, magna vestibulum aliquet ultrices, erat tortor sollicitudin mi, sit amet lobortis sapien sapien non mi. Integer ac neque.

Duis bibendum. Morbi non quam nec dui luctus rutrum. Nulla tellus."""
b206f2a3-5ddd-47a3-8884-c56d41266413,f8c1ed92-4786-4f9c-bb84-1596dde0a5bb,otro,1.25,"""Cum sociis natoque penatibus et magnis dis parturient montes nascetur ridiculus mus. Vivamus vestibulum sagittis sapien. Cum sociis natoque penatibus et magnis dis parturient montes nascetur ridiculus mus.

Etiam vel augue. Vestibulum rutrum rutrum neque. Aenean auctor gravida sem.""","""Quisque id justo sit amet sapien dignissim vestibulum. Vestibulum ante ipsum primis in faucibus orci luctus et ultrices posuere cubilia Curae; Nulla dapibus dolor vel est. Donec odio justo, sollicitudin ut, suscipit a, feugiat et, eros."""
147cd3b7-c8c6-4b6d-8203-712dacfe22b6,40613c17-e5e7-4d12-aa4d-6e24437fffe6,hiit,1.67,"""Duis consequat dui nec nisi volutpat eleifend. Donec ut dolor. Morbi vel lectus in quam fringilla rhoncus.""","""Maecenas leo odio, condimentum id, luctus nec, molestie sed, justo. Pellentesque viverra pede ac diam. Cras pellentesque volutpat dui."""
0c384ba2-f2c6-4ca0-bf0a-6bac6a4bbbfa,88d695a1-1c4a-48e0-abfa-9246349ea3ef,triatlon,1,"""Cras non velit nec nisi vulputate nonummy. Maecenas tincidunt lacus at velit. Vivamus vel nulla eget eros elementum pellentesque.

Quisque porta volutpat erat. Quisque erat eros viverra eget congue eget semper rutrum nulla. Nunc purus.""","""Mauris enim leo, rhoncus sed, vestibulum sit amet, cursus id, turpis. Integer aliquet, massa id lobortis convallis, tortor risus dapibus augue, vel accumsan tellus nisi eu orci. Mauris lacinia sapien quis libero."""
bd1a59f8-8928-4e7b-be89-7b8a8346cfde,da8f364f-cd65-474d-b114-036b94d0419b,otro,1.56,"""Mauris enim leo rhoncus sed vestibulum sit amet cursus id turpis. Integer aliquet massa id lobortis convallis tortor risus dapibus augue vel accumsan tellus nisi eu orci. Mauris lacinia sapien quis libero.

Nullam sit amet turpis elementum ligula vehicula consequat. Morbi a ipsum. Integer a nibh.""","""Integer ac leo. Pellentesque ultrices mattis odio. Donec vitae nisi."""
952079f9-5b2e-4fe8-a3a0-302fd7ced8fe,9f6a1ff5-24ba-478c-afc1-092c8d1e7256,otro,1.27,"""Duis bibendum felis sed interdum venenatis turpis enim blandit mi in porttitor pede justo eu massa. Donec dapibus. Duis at velit eu est congue elementum.""","""Cum sociis natoque penatibus et magnis dis parturient montes, nascetur ridiculus mus. Vivamus vestibulum sagittis sapien. Cum sociis natoque penatibus et magnis dis parturient montes, nascetur ridiculus mus."""
2c829d9d-fe05-41cb-84cb-f634db3e50f3,217c6845-7c0d-4bf0-96ca-44b045d39c3d,bajar de peso,1.37,"""Curabitur in libero ut massa volutpat convallis. Morbi odio odio elementum eu interdum eu tincidunt in leo. Maecenas pulvinar lobortis est.

Phasellus sit amet erat. Nulla tempus. Vivamus in felis eu sapien cursus vestibulum.""","""Praesent id massa id nisl venenatis lacinia. Aenean sit amet justo. Morbi ut odio."""
1e2d7203-4d5d-4bcd-8692-56fe354b321f,a533b8dd-d69d-4805-bef4-47e036842b99,bajar de peso,0.58,"""Fusce consequat. Nulla nisl. Nunc nisl.

Duis bibendum felis sed interdum venenatis turpis enim blandit mi in porttitor pede justo eu massa. Donec dapibus. Duis at velit eu est congue elementum.""","""Curabitur gravida nisi at nibh. In hac habitasse platea dictumst. Aliquam augue quam, sollicitudin vitae, consectetuer eget, rutrum at, lorem.

Integer tincidunt ante vel ipsum. Praesent blandit lacinia erat. Vestibulum sed magna at nunc commodo placerat."""
5e91d1d7-7a6d-45c5-bf45-af03bdc65f63,3fa6fb41-0984-4859-bb7d-236d3d05dd4c,disminuir stress,1.1,"""Maecenas ut massa quis augue luctus tincidunt. Nulla mollis molestie lorem. Quisque ut erat.

Curabitur gravida nisi at nibh. In hac habitasse platea dictumst. Aliquam augue quam sollicitudin vitae consectetuer eget rutrum at lorem.""","""Cum sociis natoque penatibus et magnis dis parturient montes, nascetur ridiculus mus. Vivamus vestibulum sagittis sapien. Cum sociis natoque penatibus et magnis dis parturient montes, nascetur ridiculus mus."""
9486001c-d371-4452-863e-13f6b2b4cd18,09811ba4-6c48-4da9-ba48-68a20956891a,bajar de peso,1.37,"""Mauris enim leo rhoncus sed vestibulum sit amet cursus id turpis. Integer aliquet massa id lobortis convallis tortor risus dapibus augue vel accumsan tellus nisi eu orci. Mauris lacinia sapien quis libero.

Nullam sit amet turpis elementum ligula vehicula consequat. Morbi a ipsum. Integer a nibh.""","""Curabitur in libero ut massa volutpat convallis. Morbi odio odio, elementum eu, interdum eu, tincidunt in, leo. Maecenas pulvinar lobortis est.

Phasellus sit amet erat. Nulla tempus. Vivamus in felis eu sapien cursus vestibulum."""
ae8ad1f2-6948-4834-a3e8-7d67f3a2d137,2c5556f3-2ea1-44bc-a1b5-d80f9d0086ef,otro,1.4,"""Vestibulum ac est lacinia nisi venenatis tristique. Fusce congue diam id ornare imperdiet sapien urna pretium nisl ut volutpat sapien arcu sed augue. Aliquam erat volutpat.""","""Sed sagittis. Nam congue, risus semper porta volutpat, quam pede lobortis ligula, sit amet eleifend pede libero quis orci. Nullam molestie nibh in lectus.

Pellentesque at nulla. Suspendisse potenti. Cras in purus eu magna vulputate luctus."""
ad24d4a2-6d6a-4fdf-86ec-f76929fdeb10,47a17097-468a-4768-a59a-caaee73443a8,bajar de peso,1.85,"""Vestibulum ac est lacinia nisi venenatis tristique. Fusce congue diam id ornare imperdiet sapien urna pretium nisl ut volutpat sapien arcu sed augue. Aliquam erat volutpat.

In congue. Etiam justo. Etiam pretium iaculis justo.""","""Proin leo odio, porttitor id, consequat in, consequat ut, nulla. Sed accumsan felis. Ut at dolor quis odio consequat varius.

Integer ac leo. Pellentesque ultrices mattis odio. Donec vitae nisi."""
45d226cb-97e2-468d-b960-ec20370809f9,b16efe3f-0350-43c5-88ac-37328e19d5bf,disminuir stress,0.82,"""Maecenas tristique est et tempus semper est quam pharetra magna ac consequat metus sapien ut nunc. Vestibulum ante ipsum primis in faucibus orci luctus et ultrices posuere cubilia Curae; Mauris viverra diam vitae quam. Suspendisse potenti.""","""Nullam porttitor lacus at turpis. Donec posuere metus vitae ipsum. Aliquam non mauris."""
6d2e59c2-d835-4d09-afd5-9c09b3828f9c,e47d2be1-c11a-496c-bb5a-95fc7df7d00c,disminuir stress,0.54,"""Proin interdum mauris non ligula pellentesque ultrices. Phasellus id sapien in sapien iaculis congue. Vivamus metus arcu adipiscing molestie hendrerit at vulputate vitae nisl.""","""Morbi non lectus. Aliquam sit amet diam in magna bibendum imperdiet. Nullam orci pede, venenatis non, sodales sed, tincidunt eu, felis."""
3daa65e4-958b-4eb2-8974-52973b14d76c,baf9dcf3-22ef-4758-8a08-0c84599c326c,media-maraton,1.74,"""Cras non velit nec nisi vulputate nonummy. Maecenas tincidunt lacus at velit. Vivamus vel nulla eget eros elementum pellentesque.""","""Mauris enim leo, rhoncus sed, vestibulum sit amet, cursus id, turpis. Integer aliquet, massa id lobortis convallis, tortor risus dapibus augue, vel accumsan tellus nisi eu orci. Mauris lacinia sapien quis libero."""
a862dc28-bd36-4575-a687-839c8bf9fb99,449c2bb4-4aa9-42ce-8299-4e139111b1d4,condicionamiento,0.51,"""Proin interdum mauris non ligula pellentesque ultrices. Phasellus id sapien in sapien iaculis congue. Vivamus metus arcu adipiscing molestie hendrerit at vulputate vitae nisl.""","""In quis justo. Maecenas rhoncus aliquam lacus. Morbi quis tortor id nulla ultrices aliquet."""
03469e27-a2dd-4368-99a3-f96625f35dcd,9c1fc515-099c-4c85-8d17-03de61a26a6a,triatlon,1.98,"""Suspendisse potenti. In eleifend quam a odio. In hac habitasse platea dictumst.""","""Proin interdum mauris non ligula pellentesque ultrices. Phasellus id sapien in sapien iaculis congue. Vivamus metus arcu, adipiscing molestie, hendrerit at, vulputate vitae, nisl."""
cd4d63b1-f532-45d1-a117-e828eebad63b,494a3c85-d471-434e-81a3-a1649f0dc768,bajar de peso,1.12,"""Sed sagittis. Nam congue risus semper porta volutpat quam pede lobortis ligula sit amet eleifend pede libero quis orci. Nullam molestie nibh in lectus.

Pellentesque at nulla. Suspendisse potenti. Cras in purus eu magna vulputate luctus.""","""Vestibulum quam sapien, varius ut, blandit non, interdum in, ante. Vestibulum ante ipsum primis in faucibus orci luctus et ultrices posuere cubilia Curae; Duis faucibus accumsan odio. Curabitur convallis."""
8786b492-1eb5-455e-ab37-26945e2bdc04,bbc43682-f574-488b-ad19-a8d4c9f615cd,condicionamiento,1.06,"""Aenean fermentum. Donec ut mauris eget massa tempor convallis. Nulla neque libero convallis eget eleifend luctus ultricies eu nibh.

Quisque id justo sit amet sapien dignissim vestibulum. Vestibulum ante ipsum primis in faucibus orci luctus et ultrices posuere cubilia Curae; Nulla dapibus dolor vel est. Donec odio justo sollicitudin ut suscipit a feugiat et eros.""","""Duis bibendum, felis sed interdum venenatis, turpis enim blandit mi, in porttitor pede justo eu massa. Donec dapibus. Duis at velit eu est congue elementum.

In hac habitasse platea dictumst. Morbi vestibulum, velit id pretium iaculis, diam erat fermentum justo, nec condimentum neque sapien placerat ante. Nulla justo."""
dc1862f2-debb-4d6b-970b-94e845de677d,0a0d4d37-701a-4df6-8b88-84fa81775cba,maraton,0.84,"""Aenean lectus. Pellentesque eget nunc. Donec quis orci eget orci vehicula condimentum.

Curabitur in libero ut massa volutpat convallis. Morbi odio odio elementum eu interdum eu tincidunt in leo. Maecenas pulvinar lobortis est.""","""Mauris enim leo, rhoncus sed, vestibulum sit amet, cursus id, turpis. Integer aliquet, massa id lobortis convallis, tortor risus dapibus augue, vel accumsan tellus nisi eu orci. Mauris lacinia sapien quis libero.

Nullam sit amet turpis elementum ligula vehicula consequat. Morbi a ipsum. Integer a nibh."""
1ef99c15-2172-4791-bb52-2b132ee2cf18,8591ef1d-2bf0-4223-a5b8-95cb0f67e1ea,triatlon,1.16,"""Morbi non lectus. Aliquam sit amet diam in magna bibendum imperdiet. Nullam orci pede venenatis non sodales sed tincidunt eu felis.

Fusce posuere felis sed lacus. Morbi sem mauris laoreet ut rhoncus aliquet pulvinar sed nisl. Nunc rhoncus dui vel sem.""","""Phasellus sit amet erat. Nulla tempus. Vivamus in felis eu sapien cursus vestibulum.

Proin eu mi. Nulla ac enim. In tempor, turpis nec euismod scelerisque, quam turpis adipiscing lorem, vitae mattis nibh ligula nec sem."""
ca99d08e-7783-466f-a24e-3207935fc6c1,0e25187e-ab3c-47e2-8d7d-d738716b5373,hiit,1.84,"""Maecenas tristique est et tempus semper est quam pharetra magna ac consequat metus sapien ut nunc. Vestibulum ante ipsum primis in faucibus orci luctus et ultrices posuere cubilia Curae; Mauris viverra diam vitae quam. Suspendisse potenti.""","""Aenean lectus. Pellentesque eget nunc. Donec quis orci eget orci vehicula condimentum.

Curabitur in libero ut massa volutpat convallis. Morbi odio odio, elementum eu, interdum eu, tincidunt in, leo. Maecenas pulvinar lobortis est."""
56eca8aa-8e96-43f5-a99f-1e5bdf5abf8f,410834b9-fb20-41a7-97c1-e4427001e5ff,media-maraton,0.78,"""Integer tincidunt ante vel ipsum. Praesent blandit lacinia erat. Vestibulum sed magna at nunc commodo placerat.""","""Fusce posuere felis sed lacus. Morbi sem mauris, laoreet ut, rhoncus aliquet, pulvinar sed, nisl. Nunc rhoncus dui vel sem."""
0130b901-c4b4-4774-9dd2-d09e5f88d9d5,9f2b300e-427e-4f7c-8e6a-a2fa2995a6a5,media-maraton,1.45,"""Sed sagittis. Nam congue risus semper porta volutpat quam pede lobortis ligula sit amet eleifend pede libero quis orci. Nullam molestie nibh in lectus.

Pellentesque at nulla. Suspendisse potenti. Cras in purus eu magna vulputate luctus.""","""Nam ultrices, libero non mattis pulvinar, nulla pede ullamcorper augue, a suscipit nulla elit ac nulla. Sed vel enim sit amet nunc viverra dapibus. Nulla suscipit ligula in lacus."""
8e531254-3f29-4ecd-be73-ab61208af25f,e2bfde87-6a29-4ff8-b2f5-e9f14a7696d6,triatlon,1.47,"""Duis bibendum felis sed interdum venenatis turpis enim blandit mi in porttitor pede justo eu massa. Donec dapibus. Duis at velit eu est congue elementum.

In hac habitasse platea dictumst. Morbi vestibulum velit id pretium iaculis diam erat fermentum justo nec condimentum neque sapien placerat ante. Nulla justo.""","""In congue. Etiam justo. Etiam pretium iaculis justo."""
341b5fbd-b0b7-4e47-85c4-fd1ea3656dc3,fda4c156-bc8f-4799-83d5-5f09451171c3,triatlon,1.21,"""Etiam vel augue. Vestibulum rutrum rutrum neque. Aenean auctor gravida sem.

Praesent id massa id nisl venenatis lacinia. Aenean sit amet justo. Morbi ut odio.""","""Morbi non lectus. Aliquam sit amet diam in magna bibendum imperdiet. Nullam orci pede, venenatis non, sodales sed, tincidunt eu, felis.

Fusce posuere felis sed lacus. Morbi sem mauris, laoreet ut, rhoncus aliquet, pulvinar sed, nisl. Nunc rhoncus dui vel sem."""
b112c148-da95-4d21-ba42-7ddf77409e10,3aa41091-0088-4e56-936b-2ab6044272ea,maraton,1.95,"""Donec diam neque vestibulum eget vulputate ut ultrices vel augue. Vestibulum ante ipsum primis in faucibus orci luctus et ultrices posuere cubilia Curae; Donec pharetra magna vestibulum aliquet ultrices erat tortor sollicitudin mi sit amet lobortis sapien sapien non mi. Integer ac neque.

Duis bibendum. Morbi non quam nec dui luctus rutrum. Nulla tellus.""","""Integer tincidunt ante vel ipsum. Praesent blandit lacinia erat. Vestibulum sed magna at nunc commodo placerat.

Praesent blandit. Nam nulla. Integer pede justo, lacinia eget, tincidunt eget, tempus vel, pede."""
7e4a404b-8627-4993-bfde-71bdd1745e33,1ec4f9b3-b69a-4bde-8cd7-c10b802c2f1c,hiit,1.59,"""Proin leo odio porttitor id consequat in consequat ut nulla. Sed accumsan felis. Ut at dolor quis odio consequat varius.

Integer ac leo. Pellentesque ultrices mattis odio. Donec vitae nisi.""","""Nulla ut erat id mauris vulputate elementum. Nullam varius. Nulla facilisi.

Cras non velit nec nisi vulputate nonummy. Maecenas tincidunt lacus at velit. Vivamus vel nulla eget eros elementum pellentesque."""
1a257404-2741-4d5b-aae3-90f1e49b0471,2acff5df-2cbb-4abd-8453-edc650be9cc9,bajar de peso,1.86,"""Curabitur in libero ut massa volutpat convallis. Morbi odio odio elementum eu interdum eu tincidunt in leo. Maecenas pulvinar lobortis est.

Phasellus sit amet erat. Nulla tempus. Vivamus in felis eu sapien cursus vestibulum.""","""In quis justo. Maecenas rhoncus aliquam lacus. Morbi quis tortor id nulla ultrices aliquet."""
296f1010-fd8b-4feb-a7dc-64d429099a65,5fcfc713-68bf-448a-b97e-3df97a582b84,hiit,0.66,"""Duis bibendum felis sed interdum venenatis turpis enim blandit mi in porttitor pede justo eu massa. Donec dapibus. Duis at velit eu est congue elementum.""","""Cras mi pede, malesuada in, imperdiet et, commodo vulputate, justo. In blandit ultrices enim. Lorem ipsum dolor sit amet, consectetuer adipiscing elit.

Proin interdum mauris non ligula pellentesque ultrices. Phasellus id sapien in sapien iaculis congue. Vivamus metus arcu, adipiscing molestie, hendrerit at, vulputate vitae, nisl."""
d3c2f38b-249f-40c1-8230-d0ee763aa16e,e107d0ca-6628-4f02-96a1-73adb2ab75c6,disminuir stress,1.55,"""In sagittis dui vel nisl. Duis ac nibh. Fusce lacus purus aliquet at feugiat non pretium quis lectus.

Suspendisse potenti. In eleifend quam a odio. In hac habitasse platea dictumst.""","""Duis aliquam convallis nunc. Proin at turpis a pede posuere nonummy. Integer non velit.

Donec diam neque, vestibulum eget, vulputate ut, ultrices vel, augue. Vestibulum ante ipsum primis in faucibus orci luctus et ultrices posuere cubilia Curae; Donec pharetra, magna vestibulum aliquet ultrices, erat tortor sollicitudin mi, sit amet lobortis sapien sapien non mi. Integer ac neque."""
b206f2a3-5ddd-47a3-8884-c56d41266413,fbe4e8b8-3791-4e02-98dd-a19ccb5dce87,disminuir stress,1.88,"""Fusce posuere felis sed lacus. Morbi sem mauris laoreet ut rhoncus aliquet pulvinar sed nisl. Nunc rhoncus dui vel sem.

Sed sagittis. Nam congue risus semper porta volutpat quam pede lobortis ligula sit amet eleifend pede libero quis orci. Nullam molestie nibh in lectus.""","""In hac habitasse platea dictumst. Etiam faucibus cursus urna. Ut tellus.

Nulla ut erat id mauris vulputate elementum. Nullam varius. Nulla facilisi."""
147cd3b7-c8c6-4b6d-8203-712dacfe22b6,5f6edf42-cc7d-41fd-8dc1-7c55f98a7961,triatlon,0.64,"""Fusce consequat. Nulla nisl. Nunc nisl.""","""Praesent blandit. Nam nulla. Integer pede justo, lacinia eget, tincidunt eget, tempus vel, pede."""
0c384ba2-f2c6-4ca0-bf0a-6bac6a4bbbfa,5001784f-ffda-4113-a618-60d672139975,disminuir stress,0.71,"""Cum sociis natoque penatibus et magnis dis parturient montes nascetur ridiculus mus. Vivamus vestibulum sagittis sapien. Cum sociis natoque penatibus et magnis dis parturient montes nascetur ridiculus mus.

Etiam vel augue. Vestibulum rutrum rutrum neque. Aenean auctor gravida sem.""","""In hac habitasse platea dictumst. Etiam faucibus cursus urna. Ut tellus."""
bd1a59f8-8928-4e7b-be89-7b8a8346cfde,fb198e1e-d770-4c3b-89b1-52c87994a16e,disminuir stress,1.46,"""Morbi porttitor lorem id ligula. Suspendisse ornare consequat lectus. In est risus auctor sed tristique in tempus sit amet sem.

Fusce consequat. Nulla nisl. Nunc nisl.""","""Curabitur in libero ut massa volutpat convallis. Morbi odio odio, elementum eu, interdum eu, tincidunt in, leo. Maecenas pulvinar lobortis est."""
952079f9-5b2e-4fe8-a3a0-302fd7ced8fe,0a2c3d01-e0a2-4062-9fa7-948f9b7851f0,disminuir stress,1.87,"""Vestibulum quam sapien varius ut blandit non interdum in ante. Vestibulum ante ipsum primis in faucibus orci luctus et ultrices posuere cubilia Curae; Duis faucibus accumsan odio. Curabitur convallis.""","""Morbi porttitor lorem id ligula. Suspendisse ornare consequat lectus. In est risus, auctor sed, tristique in, tempus sit amet, sem."""
2c829d9d-fe05-41cb-84cb-f634db3e50f3,2e482302-959a-4ec2-8ece-6c7728f15588,maraton,1.35,"""Curabitur gravida nisi at nibh. In hac habitasse platea dictumst. Aliquam augue quam sollicitudin vitae consectetuer eget rutrum at lorem.""","""Donec diam neque, vestibulum eget, vulputate ut, ultrices vel, augue. Vestibulum ante ipsum primis in faucibus orci luctus et ultrices posuere cubilia Curae; Donec pharetra, magna vestibulum aliquet ultrices, erat tortor sollicitudin mi, sit amet lobortis sapien sapien non mi. Integer ac neque.

Duis bibendum. Morbi non quam nec dui luctus rutrum. Nulla tellus."""
1e2d7203-4d5d-4bcd-8692-56fe354b321f,4c4fedfa-decc-4b29-9c85-26c4601872fa,otro,0.76,"""Integer tincidunt ante vel ipsum. Praesent blandit lacinia erat. Vestibulum sed magna at nunc commodo placerat.

Praesent blandit. Nam nulla. Integer pede justo lacinia eget tincidunt eget tempus vel pede.""","""In hac habitasse platea dictumst. Etiam faucibus cursus urna. Ut tellus.

Nulla ut erat id mauris vulputate elementum. Nullam varius. Nulla facilisi."""
5e91d1d7-7a6d-45c5-bf45-af03bdc65f63,eef074ca-89b6-4dc8-9b3b-9760198df371,hiit,1.06,"""Nullam porttitor lacus at turpis. Donec posuere metus vitae ipsum. Aliquam non mauris.""","""Cum sociis natoque penatibus et magnis dis parturient montes, nascetur ridiculus mus. Vivamus vestibulum sagittis sapien. Cum sociis natoque penatibus et magnis dis parturient montes, nascetur ridiculus mus.

Etiam vel augue. Vestibulum rutrum rutrum neque. Aenean auctor gravida sem."""
9486001c-d371-4452-863e-13f6b2b4cd18,c21d43ae-5df1-41c1-aa7d-07412a7c714a,bajar de peso,0.78,"""Fusce posuere felis sed lacus. Morbi sem mauris laoreet ut rhoncus aliquet pulvinar sed nisl. Nunc rhoncus dui vel sem.

Sed sagittis. Nam congue risus semper porta volutpat quam pede lobortis ligula sit amet eleifend pede libero quis orci. Nullam molestie nibh in lectus.""","""Aenean fermentum. Donec ut mauris eget massa tempor convallis. Nulla neque libero, convallis eget, eleifend luctus, ultricies eu, nibh.

Quisque id justo sit amet sapien dignissim vestibulum. Vestibulum ante ipsum primis in faucibus orci luctus et ultrices posuere cubilia Curae; Nulla dapibus dolor vel est. Donec odio justo, sollicitudin ut, suscipit a, feugiat et, eros."""
ae8ad1f2-6948-4834-a3e8-7d67f3a2d137,7dd27d86-21d4-4a0c-9f38-aa8a4613ed13,triatlon,0.64,"""Quisque id justo sit amet sapien dignissim vestibulum. Vestibulum ante ipsum primis in faucibus orci luctus et ultrices posuere cubilia Curae; Nulla dapibus dolor vel est. Donec odio justo sollicitudin ut suscipit a feugiat et eros.

Vestibulum ac est lacinia nisi venenatis tristique. Fusce congue diam id ornare imperdiet sapien urna pretium nisl ut volutpat sapien arcu sed augue. Aliquam erat volutpat.""","""Maecenas leo odio, condimentum id, luctus nec, molestie sed, justo. Pellentesque viverra pede ac diam. Cras pellentesque volutpat dui."""
ad24d4a2-6d6a-4fdf-86ec-f76929fdeb10,96e8705b-0edc-4bb9-b514-e54bd88743f2,maraton,1.84,"""Sed ante. Vivamus tortor. Duis mattis egestas metus.

Aenean fermentum. Donec ut mauris eget massa tempor convallis. Nulla neque libero convallis eget eleifend luctus ultricies eu nibh.""","""Integer ac leo. Pellentesque ultrices mattis odio. Donec vitae nisi."""
45d226cb-97e2-468d-b960-ec20370809f9,d997f000-f3a7-4ef2-8a4f-86f486346a40,media-maraton,0.76,"""Fusce posuere felis sed lacus. Morbi sem mauris laoreet ut rhoncus aliquet pulvinar sed nisl. Nunc rhoncus dui vel sem.""","""Nam ultrices, libero non mattis pulvinar, nulla pede ullamcorper augue, a suscipit nulla elit ac nulla. Sed vel enim sit amet nunc viverra dapibus. Nulla suscipit ligula in lacus."""
6d2e59c2-d835-4d09-afd5-9c09b3828f9c,effa9d57-f43b-409e-861f-ca6e557ce29b,triatlon,0.87,"""Aliquam quis turpis eget elit sodales scelerisque. Mauris sit amet eros. Suspendisse accumsan tortor quis turpis.

Sed ante. Vivamus tortor. Duis mattis egestas metus.""","""Proin eu mi. Nulla ac enim. In tempor, turpis nec euismod scelerisque, quam turpis adipiscing lorem, vitae mattis nibh ligula nec sem.

Duis aliquam convallis nunc. Proin at turpis a pede posuere nonummy. Integer non velit."""
3daa65e4-958b-4eb2-8974-52973b14d76c,da2c7df2-ac18-4ce5-b881-72003ae81bee,maraton,1.28,"""Pellentesque at nulla. Suspendisse potenti. Cras in purus eu magna vulputate luctus.""","""Proin leo odio, porttitor id, consequat in, consequat ut, nulla. Sed accumsan felis. Ut at dolor quis odio consequat varius."""
a862dc28-bd36-4575-a687-839c8bf9fb99,71decf75-fc33-4880-9ff4-4127745b596c,media-maraton,1.27,"""Cras mi pede malesuada in imperdiet et commodo vulputate justo. In blandit ultrices enim. Lorem ipsum dolor sit amet consectetuer adipiscing elit.

Proin interdum mauris non ligula pellentesque ultrices. Phasellus id sapien in sapien iaculis congue. Vivamus metus arcu adipiscing molestie hendrerit at vulputate vitae nisl.""","""In hac habitasse platea dictumst. Morbi vestibulum, velit id pretium iaculis, diam erat fermentum justo, nec condimentum neque sapien placerat ante. Nulla justo.

Aliquam quis turpis eget elit sodales scelerisque. Mauris sit amet eros. Suspendisse accumsan tortor quis turpis."""
03469e27-a2dd-4368-99a3-f96625f35dcd,ad978678-a005-4875-ad3d-0616f9b9f184,condicionamiento,1.64,"""Morbi non lectus. Aliquam sit amet diam in magna bibendum imperdiet. Nullam orci pede venenatis non sodales sed tincidunt eu felis.""","""Proin eu mi. Nulla ac enim. In tempor, turpis nec euismod scelerisque, quam turpis adipiscing lorem, vitae mattis nibh ligula nec sem.

Duis aliquam convallis nunc. Proin at turpis a pede posuere nonummy. Integer non velit."""
cd4d63b1-f532-45d1-a117-e828eebad63b,8039dd75-1dbb-4fce-82a4-c74e024e39ef,media-maraton,0.82,"""Nullam sit amet turpis elementum ligula vehicula consequat. Morbi a ipsum. Integer a nibh.""","""Etiam vel augue. Vestibulum rutrum rutrum neque. Aenean auctor gravida sem.

Praesent id massa id nisl venenatis lacinia. Aenean sit amet justo. Morbi ut odio."""
8786b492-1eb5-455e-ab37-26945e2bdc04,b2bb3861-460b-400e-8f37-2292513a78bd,otro,1.38,"""Donec diam neque vestibulum eget vulputate ut ultrices vel augue. Vestibulum ante ipsum primis in faucibus orci luctus et ultrices posuere cubilia Curae; Donec pharetra magna vestibulum aliquet ultrices erat tortor sollicitudin mi sit amet lobortis sapien sapien non mi. Integer ac neque.

Duis bibendum. Morbi non quam nec dui luctus rutrum. Nulla tellus.""","""Sed ante. Vivamus tortor. Duis mattis egestas metus.

Aenean fermentum. Donec ut mauris eget massa tempor convallis. Nulla neque libero, convallis eget, eleifend luctus, ultricies eu, nibh."""
