id_plan,id_usuario,tipo,plan_duracion,instructions,objectivo
bd1a59f8-8928-4e7b-be89-7b8a8346cfde,9d7dcc17-4f52-4ba0-9454-5d1b2c943eaf,otro,1.58,"""Proin interdum mauris non ligula pellentesque ultrices. Phasellus id sapien in sapien iaculis congue. Vivamus metus arcu adipiscing molestie hendrerit at vulputate vitae nisl.

Aenean lectus. Pellentesque eget nunc. Donec quis orci eget orci vehicula condimentum.""","""Nulla ut erat id mauris vulputate elementum. Nullam varius. Nulla facilisi."""
952079f9-5b2e-4fe8-a3a0-302fd7ced8fe,815ddd26-226c-4c9e-bea5-4cf527f6c9b9,triatlon,1.77,"""Cras non velit nec nisi vulputate nonummy. Maecenas tincidunt lacus at velit. Vivamus vel nulla eget eros elementum pellentesque.

Quisque porta volutpat erat. Quisque erat eros viverra eget congue eget semper rutrum nulla. Nunc purus.""","""Donec diam neque, vestibulum eget, vulputate ut, ultrices vel, augue. Vestibulum ante ipsum primis in faucibus orci luctus et ultrices posuere cubilia Curae; Donec pharetra, magna vestibulum aliquet ultrices, erat tortor sollicitudin mi, sit amet lobortis sapien sapien non mi. Integer ac neque.

Duis bibendum. Morbi non quam nec dui luctus rutrum. Nulla tellus."""
2c829d9d-fe05-41cb-84cb-f634db3e50f3,ef62883d-cd11-488a-a145-a9974c26b632,media-maraton,1.88,"""Cras non velit nec nisi vulputate nonummy. Maecenas tincidunt lacus at velit. Vivamus vel nulla eget eros elementum pellentesque.

Quisque porta volutpat erat. Quisque erat eros viverra eget congue eget semper rutrum nulla. Nunc purus.""","""Proin eu mi. Nulla ac enim. In tempor, turpis nec euismod scelerisque, quam turpis adipiscing lorem, vitae mattis nibh ligula nec sem."""
1e2d7203-4d5d-4bcd-8692-56fe354b321f,8630e638-f8b5-4815-a4a1-58184af549ae,media-maraton,1.38,"""Lorem ipsum dolor sit amet consectetuer adipiscing elit. Proin risus. Praesent lectus.

Vestibulum quam sapien varius ut blandit non interdum in ante. Vestibulum ante ipsum primis in faucibus orci luctus et ultrices posuere cubilia Curae; Duis faucibus accumsan odio. Curabitur convallis.""","""Morbi non lectus. Aliquam sit amet diam in magna bibendum imperdiet. Nullam orci pede, venenatis non, sodales sed, tincidunt eu, felis."""
5e91d1d7-7a6d-45c5-bf45-af03bdc65f63,b7ff96d3-94ae-4eb7-9c0d-40b95a646b51,media-maraton,1.32,"""Morbi non lectus. Aliquam sit amet diam in magna bibendum imperdiet. Nullam orci pede venenatis non sodales sed tincidunt eu felis.

Fusce posuere felis sed lacus. Morbi sem mauris laoreet ut rhoncus aliquet pulvinar sed nisl. Nunc rhoncus dui vel sem.""","""Maecenas ut massa quis augue luctus tincidunt. Nulla mollis molestie lorem. Quisque ut erat.

Curabitur gravida nisi at nibh. In hac habitasse platea dictumst. Aliquam augue quam, sollicitudin vitae, consectetuer eget, rutrum at, lorem."""
9486001c-d371-4452-863e-13f6b2b4cd18,b4862156-4a99-4088-a336-c1a9c7dbfa21,triatlon,1.05,"""Suspendisse potenti. In eleifend quam a odio. In hac habitasse platea dictumst.

Maecenas ut massa quis augue luctus tincidunt. Nulla mollis molestie lorem. Quisque ut erat.""","""Proin eu mi. Nulla ac enim. In tempor, turpis nec euismod scelerisque, quam turpis adipiscing lorem, vitae mattis nibh ligula nec sem."""
ae8ad1f2-6948-4834-a3e8-7d67f3a2d137,c68c27f3-6699-4b9c-87ed-bfa511a0db0e,bajar de peso,1.96,"""Aenean fermentum. Donec ut mauris eget massa tempor convallis. Nulla neque libero convallis eget eleifend luctus ultricies eu nibh.""","""Fusce posuere felis sed lacus. Morbi sem mauris, laoreet ut, rhoncus aliquet, pulvinar sed, nisl. Nunc rhoncus dui vel sem."""
ad24d4a2-6d6a-4fdf-86ec-f76929fdeb10,7a3ba5e4-a97e-454c-85d7-23a7fc486ea6,condicionamiento,0.64,"""Donec diam neque vestibulum eget vulputate ut ultrices vel augue. Vestibulum ante ipsum primis in faucibus orci luctus et ultrices posuere cubilia Curae; Donec pharetra magna vestibulum aliquet ultrices erat tortor sollicitudin mi sit amet lobortis sapien sapien non mi. Integer ac neque.

Duis bibendum. Morbi non quam nec dui luctus rutrum. Nulla tellus.""","""Vestibulum quam sapien, varius ut, blandit non, interdum in, ante. Vestibulum ante ipsum primis in faucibus orci luctus et ultrices posuere cubilia Curae; Duis faucibus accumsan odio. Curabitur convallis.

Duis consequat dui nec nisi volutpat eleifend. Donec ut dolor. Morbi vel lectus in quam fringilla rhoncus."""
45d226cb-97e2-468d-b960-ec20370809f9,f1ddf999-e9e3-4dd3-bde3-36e50d4c99de,media-maraton,1.37,"""Morbi non lectus. Aliquam sit amet diam in magna bibendum imperdiet. Nullam orci pede venenatis non sodales sed tincidunt eu felis.

Fusce posuere felis sed lacus. Morbi sem mauris laoreet ut rhoncus aliquet pulvinar sed nisl. Nunc rhoncus dui vel sem.""","""Praesent blandit. Nam nulla. Integer pede justo, lacinia eget, tincidunt eget, tempus vel, pede."""
6d2e59c2-d835-4d09-afd5-9c09b3828f9c,fb9202ff-a79c-47ce-9e2f-1566f9cd73a1,maraton,0.75,"""Vestibulum quam sapien varius ut blandit non interdum in ante. Vestibulum ante ipsum primis in faucibus orci luctus et ultrices posuere cubilia Curae; Duis faucibus accumsan odio. Curabitur convallis.""","""Nulla ut erat id mauris vulputate elementum. Nullam varius. Nulla facilisi."""
3daa65e4-958b-4eb2-8974-52973b14d76c,2b46860e-5437-47da-b60d-7d04b86e7beb,disminuir stress,1.16,"""Fusce posuere felis sed lacus. Morbi sem mauris laoreet ut rhoncus aliquet pulvinar sed nisl. Nunc rhoncus dui vel sem.

Sed sagittis. Nam congue risus semper porta volutpat quam pede lobortis ligula sit amet eleifend pede libero quis orci. Nullam molestie nibh in lectus.""","""Duis aliquam convallis nunc. Proin at turpis a pede posuere nonummy. Integer non velit."""
a862dc28-bd36-4575-a687-839c8bf9fb99,70b1cee0-15a8-4d50-98ce-4cd85e4d68aa,disminuir stress,1.8,"""Aenean fermentum. Donec ut mauris eget massa tempor convallis. Nulla neque libero convallis eget eleifend luctus ultricies eu nibh.

Quisque id justo sit amet sapien dignissim vestibulum. Vestibulum ante ipsum primis in faucibus orci luctus et ultrices posuere cubilia Curae; Nulla dapibus dolor vel est. Donec odio justo sollicitudin ut suscipit a feugiat et eros.""","""Duis bibendum, felis sed interdum venenatis, turpis enim blandit mi, in porttitor pede justo eu massa. Donec dapibus. Duis at velit eu est congue elementum."""
03469e27-a2dd-4368-99a3-f96625f35dcd,2a494bae-83d6-4a96-88c4-1fa04dee6940,disminuir stress,1.45,"""Quisque porta volutpat erat. Quisque erat eros viverra eget congue eget semper rutrum nulla. Nunc purus.

Phasellus in felis. Donec semper sapien a libero. Nam dui.""","""Curabitur at ipsum ac tellus semper interdum. Mauris ullamcorper purus sit amet nulla. Quisque arcu libero, rutrum ac, lobortis vel, dapibus at, diam."""
cd4d63b1-f532-45d1-a117-e828eebad63b,513e5920-b1b8-46f6-ace5-1249eebaa036,triatlon,0.9,"""Sed ante. Vivamus tortor. Duis mattis egestas metus.""","""Cras non velit nec nisi vulputate nonummy. Maecenas tincidunt lacus at velit. Vivamus vel nulla eget eros elementum pellentesque.

Quisque porta volutpat erat. Quisque erat eros, viverra eget, congue eget, semper rutrum, nulla. Nunc purus."""
8786b492-1eb5-455e-ab37-26945e2bdc04,ec5abf68-0e08-455a-b3cc-e38b6366f1af,media-maraton,1.11,"""Proin eu mi. Nulla ac enim. In tempor turpis nec euismod scelerisque quam turpis adipiscing lorem vitae mattis nibh ligula nec sem.

Duis aliquam convallis nunc. Proin at turpis a pede posuere nonummy. Integer non velit.""","""In sagittis dui vel nisl. Duis ac nibh. Fusce lacus purus, aliquet at, feugiat non, pretium quis, lectus."""
dc1862f2-debb-4d6b-970b-94e845de677d,c6455d7c-463b-4eed-afc5-ae95a53b2e9d,bajar de peso,0.58,"""In quis justo. Maecenas rhoncus aliquam lacus. Morbi quis tortor id nulla ultrices aliquet.""","""Etiam vel augue. Vestibulum rutrum rutrum neque. Aenean auctor gravida sem."""
1ef99c15-2172-4791-bb52-2b132ee2cf18,8221b6fd-3a0a-49f8-8329-49a05337ca99,hiit,1.25,"""In hac habitasse platea dictumst. Etiam faucibus cursus urna. Ut tellus.""","""Mauris enim leo, rhoncus sed, vestibulum sit amet, cursus id, turpis. Integer aliquet, massa id lobortis convallis, tortor risus dapibus augue, vel accumsan tellus nisi eu orci. Mauris lacinia sapien quis libero."""
ca99d08e-7783-466f-a24e-3207935fc6c1,72e4067a-ff12-4a5e-bae2-7c0c7ace8049,maraton,0.86,"""Aenean lectus. Pellentesque eget nunc. Donec quis orci eget orci vehicula condimentum.

Curabitur in libero ut massa volutpat convallis. Morbi odio odio elementum eu interdum eu tincidunt in leo. Maecenas pulvinar lobortis est.""","""Curabitur gravida nisi at nibh. In hac habitasse platea dictumst. Aliquam augue quam, sollicitudin vitae, consectetuer eget, rutrum at, lorem.

Integer tincidunt ante vel ipsum. Praesent blandit lacinia erat. Vestibulum sed magna at nunc commodo placerat."""
56eca8aa-8e96-43f5-a99f-1e5bdf5abf8f,5cf85ab7-e88a-4fd3-aa1d-b984d99a5ca0,condicionamiento,0.81,"""Duis aliquam convallis nunc. Proin at turpis a pede posuere nonummy. Integer non velit.""","""Curabitur at ipsum ac tellus semper interdum. Mauris ullamcorper purus sit amet nulla. Quisque arcu libero, rutrum ac, lobortis vel, dapibus at, diam."""
0130b901-c4b4-4774-9dd2-d09e5f88d9d5,b770a5e9-99f8-41cb-a528-31053f9caef3,condicionamiento,1.31,"""Praesent id massa id nisl venenatis lacinia. Aenean sit amet justo. Morbi ut odio.

Cras mi pede malesuada in imperdiet et commodo vulputate justo. In blandit ultrices enim. Lorem ipsum dolor sit amet consectetuer adipiscing elit.""","""Maecenas leo odio, condimentum id, luctus nec, molestie sed, justo. Pellentesque viverra pede ac diam. Cras pellentesque volutpat dui.

Maecenas tristique, est et tempus semper, est quam pharetra magna, ac consequat metus sapien ut nunc. Vestibulum ante ipsum primis in faucibus orci luctus et ultrices posuere cubilia Curae; Mauris viverra diam vitae quam. Suspendisse potenti."""
8e531254-3f29-4ecd-be73-ab61208af25f,1622f961-60d0-4732-9aed-2369d931b6ac,media-maraton,0.59,"""Nam ultrices libero non mattis pulvinar nulla pede ullamcorper augue a suscipit nulla elit ac nulla. Sed vel enim sit amet nunc viverra dapibus. Nulla suscipit ligula in lacus.""","""Mauris enim leo, rhoncus sed, vestibulum sit amet, cursus id, turpis. Integer aliquet, massa id lobortis convallis, tortor risus dapibus augue, vel accumsan tellus nisi eu orci. Mauris lacinia sapien quis libero."""
341b5fbd-b0b7-4e47-85c4-fd1ea3656dc3,c8459385-9f5b-48d0-9e18-41379d327613,hiit,0.6,"""Cras non velit nec nisi vulputate nonummy. Maecenas tincidunt lacus at velit. Vivamus vel nulla eget eros elementum pellentesque.""","""Nulla ut erat id mauris vulputate elementum. Nullam varius. Nulla facilisi.

Cras non velit nec nisi vulputate nonummy. Maecenas tincidunt lacus at velit. Vivamus vel nulla eget eros elementum pellentesque."""
b112c148-da95-4d21-ba42-7ddf77409e10,966e8118-2b2e-4d34-a8f6-0c3b37885b48,media-maraton,1.54,"""Praesent blandit. Nam nulla. Integer pede justo lacinia eget tincidunt eget tempus vel pede.

Morbi porttitor lorem id ligula. Suspendisse ornare consequat lectus. In est risus auctor sed tristique in tempus sit amet sem.""","""In hac habitasse platea dictumst. Morbi vestibulum, velit id pretium iaculis, diam erat fermentum justo, nec condimentum neque sapien placerat ante. Nulla justo."""
7e4a404b-8627-4993-bfde-71bdd1745e33,6c0a35ac-a75e-4fef-b17c-75649ba8f7cc,bajar de peso,0.8,"""Proin eu mi. Nulla ac enim. In tempor turpis nec euismod scelerisque quam turpis adipiscing lorem vitae mattis nibh ligula nec sem.

Duis aliquam convallis nunc. Proin at turpis a pede posuere nonummy. Integer non velit.""","""Lorem ipsum dolor sit amet, consectetuer adipiscing elit. Proin risus. Praesent lectus."""
1a257404-2741-4d5b-aae3-90f1e49b0471,414a716f-a0d6-4165-ac7b-17e08efc9ed0,media-maraton,1.65,"""Phasellus sit amet erat. Nulla tempus. Vivamus in felis eu sapien cursus vestibulum.

Proin eu mi. Nulla ac enim. In tempor turpis nec euismod scelerisque quam turpis adipiscing lorem vitae mattis nibh ligula nec sem.""","""Duis bibendum. Morbi non quam nec dui luctus rutrum. Nulla tellus."""
296f1010-fd8b-4feb-a7dc-64d429099a65,7b43a690-1373-4b11-b0e7-d2f76b129fb3,condicionamiento,0.83,"""Quisque porta volutpat erat. Quisque erat eros viverra eget congue eget semper rutrum nulla. Nunc purus.

Phasellus in felis. Donec semper sapien a libero. Nam dui.""","""Sed ante. Vivamus tortor. Duis mattis egestas metus.

Aenean fermentum. Donec ut mauris eget massa tempor convallis. Nulla neque libero, convallis eget, eleifend luctus, ultricies eu, nibh."""
d3c2f38b-249f-40c1-8230-d0ee763aa16e,a556e02a-e9ba-463a-8659-bb950d1e30d2,hiit,0.56,"""Proin interdum mauris non ligula pellentesque ultrices. Phasellus id sapien in sapien iaculis congue. Vivamus metus arcu adipiscing molestie hendrerit at vulputate vitae nisl.

Aenean lectus. Pellentesque eget nunc. Donec quis orci eget orci vehicula condimentum.""","""Morbi porttitor lorem id ligula. Suspendisse ornare consequat lectus. In est risus, auctor sed, tristique in, tempus sit amet, sem."""
b206f2a3-5ddd-47a3-8884-c56d41266413,b129587a-0107-47d4-86d5-b2fde1c5c9a0,condicionamiento,1.91,"""Sed ante. Vivamus tortor. Duis mattis egestas metus.

Aenean fermentum. Donec ut mauris eget massa tempor convallis. Nulla neque libero convallis eget eleifend luctus ultricies eu nibh.""","""Proin eu mi. Nulla ac enim. In tempor, turpis nec euismod scelerisque, quam turpis adipiscing lorem, vitae mattis nibh ligula nec sem."""
147cd3b7-c8c6-4b6d-8203-712dacfe22b6,114657a1-5a8e-4314-a14a-29f115bd766a,triatlon,1.11,"""In hac habitasse platea dictumst. Etiam faucibus cursus urna. Ut tellus.""","""Etiam vel augue. Vestibulum rutrum rutrum neque. Aenean auctor gravida sem.

Praesent id massa id nisl venenatis lacinia. Aenean sit amet justo. Morbi ut odio."""
0c384ba2-f2c6-4ca0-bf0a-6bac6a4bbbfa,34db8be1-1484-40f0-bdb7-1b461cad218c,maraton,1.29,"""Praesent blandit. Nam nulla. Integer pede justo lacinia eget tincidunt eget tempus vel pede.

Morbi porttitor lorem id ligula. Suspendisse ornare consequat lectus. In est risus auctor sed tristique in tempus sit amet sem.""","""Morbi porttitor lorem id ligula. Suspendisse ornare consequat lectus. In est risus, auctor sed, tristique in, tempus sit amet, sem."""
bd1a59f8-8928-4e7b-be89-7b8a8346cfde,24a7da6e-3a24-45ac-a680-cc1f0ea07ceb,media-maraton,1.22,"""In sagittis dui vel nisl. Duis ac nibh. Fusce lacus purus aliquet at feugiat non pretium quis lectus.""","""Nullam sit amet turpis elementum ligula vehicula consequat. Morbi a ipsum. Integer a nibh.

In quis justo. Maecenas rhoncus aliquam lacus. Morbi quis tortor id nulla ultrices aliquet."""
952079f9-5b2e-4fe8-a3a0-302fd7ced8fe,1456c2c8-933d-4316-ad95-ea954ac413d6,otro,1.84,"""In sagittis dui vel nisl. Duis ac nibh. Fusce lacus purus aliquet at feugiat non pretium quis lectus.""","""Aliquam quis turpis eget elit sodales scelerisque. Mauris sit amet eros. Suspendisse accumsan tortor quis turpis.

Sed ante. Vivamus tortor. Duis mattis egestas metus."""
2c829d9d-fe05-41cb-84cb-f634db3e50f3,da9732e5-f59f-4b09-badc-bf66f80b1c03,disminuir stress,0.92,"""Proin eu mi. Nulla ac enim. In tempor turpis nec euismod scelerisque quam turpis adipiscing lorem vitae mattis nibh ligula nec sem.""","""Integer ac leo. Pellentesque ultrices mattis odio. Donec vitae nisi."""
1e2d7203-4d5d-4bcd-8692-56fe354b321f,8684728e-ea5c-43ae-b416-cf871fb7dd0d,triatlon,1.57,"""In hac habitasse platea dictumst. Morbi vestibulum velit id pretium iaculis diam erat fermentum justo nec condimentum neque sapien placerat ante. Nulla justo.""","""In congue. Etiam justo. Etiam pretium iaculis justo."""
5e91d1d7-7a6d-45c5-bf45-af03bdc65f63,c20268a0-2ea9-422e-9065-f2ce37c2f814,maraton,1.41,"""Curabitur at ipsum ac tellus semper interdum. Mauris ullamcorper purus sit amet nulla. Quisque arcu libero rutrum ac lobortis vel dapibus at diam.""","""In hac habitasse platea dictumst. Morbi vestibulum, velit id pretium iaculis, diam erat fermentum justo, nec condimentum neque sapien placerat ante. Nulla justo."""
9486001c-d371-4452-863e-13f6b2b4cd18,5e240e11-fad1-4027-b395-5a1c28df3922,bajar de peso,1.35,"""Quisque porta volutpat erat. Quisque erat eros viverra eget congue eget semper rutrum nulla. Nunc purus.""","""Nullam sit amet turpis elementum ligula vehicula consequat. Morbi a ipsum. Integer a nibh."""
ae8ad1f2-6948-4834-a3e8-7d67f3a2d137,a97f6b72-cab2-4343-8777-ff219aacabdd,media-maraton,0.86,"""Donec diam neque vestibulum eget vulputate ut ultrices vel augue. Vestibulum ante ipsum primis in faucibus orci luctus et ultrices posuere cubilia Curae; Donec pharetra magna vestibulum aliquet ultrices erat tortor sollicitudin mi sit amet lobortis sapien sapien non mi. Integer ac neque.

Duis bibendum. Morbi non quam nec dui luctus rutrum. Nulla tellus.""","""Mauris enim leo, rhoncus sed, vestibulum sit amet, cursus id, turpis. Integer aliquet, massa id lobortis convallis, tortor risus dapibus augue, vel accumsan tellus nisi eu orci. Mauris lacinia sapien quis libero."""
ad24d4a2-6d6a-4fdf-86ec-f76929fdeb10,278550a9-0021-4076-a0a6-b3de552a1e20,media-maraton,1.81,"""Phasellus in felis. Donec semper sapien a libero. Nam dui.

Proin leo odio porttitor id consequat in consequat ut nulla. Sed accumsan felis. Ut at dolor quis odio consequat varius.""","""Phasellus sit amet erat. Nulla tempus. Vivamus in felis eu sapien cursus vestibulum.

Proin eu mi. Nulla ac enim. In tempor, turpis nec euismod scelerisque, quam turpis adipiscing lorem, vitae mattis nibh ligula nec sem."""
45d226cb-97e2-468d-b960-ec20370809f9,8a8101c4-d866-45cc-95a8-ce27f0f23240,maraton,0.67,"""Proin interdum mauris non ligula pellentesque ultrices. Phasellus id sapien in sapien iaculis congue. Vivamus metus arcu adipiscing molestie hendrerit at vulputate vitae nisl.

Aenean lectus. Pellentesque eget nunc. Donec quis orci eget orci vehicula condimentum.""","""Sed ante. Vivamus tortor. Duis mattis egestas metus.

Aenean fermentum. Donec ut mauris eget massa tempor convallis. Nulla neque libero, convallis eget, eleifend luctus, ultricies eu, nibh."""
6d2e59c2-d835-4d09-afd5-9c09b3828f9c,34593198-7364-4c2e-b6bf-0d88e1d81001,media-maraton,1.59,"""Quisque porta volutpat erat. Quisque erat eros viverra eget congue eget semper rutrum nulla. Nunc purus.

Phasellus in felis. Donec semper sapien a libero. Nam dui.""","""Pellentesque at nulla. Suspendisse potenti. Cras in purus eu magna vulputate luctus."""
3daa65e4-958b-4eb2-8974-52973b14d76c,35baef41-2b32-45bb-a9e5-aa0268c96245,media-maraton,1.35,"""In hac habitasse platea dictumst. Morbi vestibulum velit id pretium iaculis diam erat fermentum justo nec condimentum neque sapien placerat ante. Nulla justo.

Aliquam quis turpis eget elit sodales scelerisque. Mauris sit amet eros. Suspendisse accumsan tortor quis turpis.""","""Maecenas tristique, est et tempus semper, est quam pharetra magna, ac consequat metus sapien ut nunc. Vestibulum ante ipsum primis in faucibus orci luctus et ultrices posuere cubilia Curae; Mauris viverra diam vitae quam. Suspendisse potenti.

Nullam porttitor lacus at turpis. Donec posuere metus vitae ipsum. Aliquam non mauris."""
a862dc28-bd36-4575-a687-839c8bf9fb99,97e5702e-b3c8-4fde-80a4-1c226b9c461c,triatlon,2,"""Maecenas leo odio condimentum id luctus nec molestie sed justo. Pellentesque viverra pede ac diam. Cras pellentesque volutpat dui.""","""Lorem ipsum dolor sit amet, consectetuer adipiscing elit. Proin risus. Praesent lectus."""
03469e27-a2dd-4368-99a3-f96625f35dcd,e761a1f9-f4ee-4e4f-950f-54785d28f9d4,triatlon,0.86,"""Morbi non lectus. Aliquam sit amet diam in magna bibendum imperdiet. Nullam orci pede venenatis non sodales sed tincidunt eu felis.""","""Curabitur gravida nisi at nibh. In hac habitasse platea dictumst. Aliquam augue quam, sollicitudin vitae, consectetuer eget, rutrum at, lorem.

Integer tincidunt ante vel ipsum. Praesent blandit lacinia erat. Vestibulum sed magna at nunc commodo placerat."""
cd4d63b1-f532-45d1-a117-e828eebad63b,4072c384-96e3-4714-bd6f-514c421c8328,otro,1.79,"""Fusce posuere felis sed lacus. Morbi sem mauris laoreet ut rhoncus aliquet pulvinar sed nisl. Nunc rhoncus dui vel sem.

Sed sagittis. Nam congue risus semper porta volutpat quam pede lobortis ligula sit amet eleifend pede libero quis orci. Nullam molestie nibh in lectus.""","""Curabitur gravida nisi at nibh. In hac habitasse platea dictumst. Aliquam augue quam, sollicitudin vitae, consectetuer eget, rutrum at, lorem."""
8786b492-1eb5-455e-ab37-26945e2bdc04,2442ec37-f93d-4c73-9759-7935ac0b33a3,media-maraton,0.7,"""In hac habitasse platea dictumst. Etiam faucibus cursus urna. Ut tellus.""","""Curabitur in libero ut massa volutpat convallis. Morbi odio odio, elementum eu, interdum eu, tincidunt in, leo. Maecenas pulvinar lobortis est.

Phasellus sit amet erat. Nulla tempus. Vivamus in felis eu sapien cursus vestibulum."""
dc1862f2-debb-4d6b-970b-94e845de677d,7d741f71-014f-4fd5-849c-3ff2347c69c7,hiit,0.85,"""Cras mi pede malesuada in imperdiet et commodo vulputate justo. In blandit ultrices enim. Lorem ipsum dolor sit amet consectetuer adipiscing elit.""","""Aenean fermentum. Donec ut mauris eget massa tempor convallis. Nulla neque libero, convallis eget, eleifend luctus, ultricies eu, nibh."""
1ef99c15-2172-4791-bb52-2b132ee2cf18,45be453e-df48-4ce9-a220-06fa97e3c659,bajar de peso,1.35,"""Phasellus in felis. Donec semper sapien a libero. Nam dui.

Proin leo odio porttitor id consequat in consequat ut nulla. Sed accumsan felis. Ut at dolor quis odio consequat varius.""","""Morbi non lectus. Aliquam sit amet diam in magna bibendum imperdiet. Nullam orci pede, venenatis non, sodales sed, tincidunt eu, felis.

Fusce posuere felis sed lacus. Morbi sem mauris, laoreet ut, rhoncus aliquet, pulvinar sed, nisl. Nunc rhoncus dui vel sem."""
ca99d08e-7783-466f-a24e-3207935fc6c1,565179d9-64e0-4a4d-a95b-65827f176118,hiit,1.26,"""Mauris enim leo rhoncus sed vestibulum sit amet cursus id turpis. Integer aliquet massa id lobortis convallis tortor risus dapibus augue vel accumsan tellus nisi eu orci. Mauris lacinia sapien quis libero.""","""Maecenas ut massa quis augue luctus tincidunt. Nulla mollis molestie lorem. Quisque ut erat.

Curabitur gravida nisi at nibh. In hac habitasse platea dictumst. Aliquam augue quam, sollicitudin vitae, consectetuer eget, rutrum at, lorem."""
56eca8aa-8e96-43f5-a99f-1e5bdf5abf8f,5174aba5-496c-4b1e-89c0-1e7c400b5ac3,maraton,1.77,"""Praesent blandit. Nam nulla. Integer pede justo lacinia eget tincidunt eget tempus vel pede.

Morbi porttitor lorem id ligula. Suspendisse ornare consequat lectus. In est risus auctor sed tristique in tempus sit amet sem.""","""In hac habitasse platea dictumst. Morbi vestibulum, velit id pretium iaculis, diam erat fermentum justo, nec condimentum neque sapien placerat ante. Nulla justo.

Aliquam quis turpis eget elit sodales scelerisque. Mauris sit amet eros. Suspendisse accumsan tortor quis turpis."""
0130b901-c4b4-4774-9dd2-d09e5f88d9d5,80dcfbb9-7c07-4ac8-9fef-08323025f416,triatlon,1.7,"""Proin eu mi. Nulla ac enim. In tempor turpis nec euismod scelerisque quam turpis adipiscing lorem vitae mattis nibh ligula nec sem.

Duis aliquam convallis nunc. Proin at turpis a pede posuere nonummy. Integer non velit.""","""Phasellus sit amet erat. Nulla tempus. Vivamus in felis eu sapien cursus vestibulum."""
8e531254-3f29-4ecd-be73-ab61208af25f,5d0c9413-83cc-46bc-b6b2-f22ea676b189,triatlon,1.47,"""Cras non velit nec nisi vulputate nonummy. Maecenas tincidunt lacus at velit. Vivamus vel nulla eget eros elementum pellentesque.""","""Quisque id justo sit amet sapien dignissim vestibulum. Vestibulum ante ipsum primis in faucibus orci luctus et ultrices posuere cubilia Curae; Nulla dapibus dolor vel est. Donec odio justo, sollicitudin ut, suscipit a, feugiat et, eros.

Vestibulum ac est lacinia nisi venenatis tristique. Fusce congue, diam id ornare imperdiet, sapien urna pretium nisl, ut volutpat sapien arcu sed augue. Aliquam erat volutpat."""
341b5fbd-b0b7-4e47-85c4-fd1ea3656dc3,3cf4cc55-f4c9-4025-bf06-e8ad9424b318,bajar de peso,0.97,"""Quisque porta volutpat erat. Quisque erat eros viverra eget congue eget semper rutrum nulla. Nunc purus.

Phasellus in felis. Donec semper sapien a libero. Nam dui.""","""Nam ultrices, libero non mattis pulvinar, nulla pede ullamcorper augue, a suscipit nulla elit ac nulla. Sed vel enim sit amet nunc viverra dapibus. Nulla suscipit ligula in lacus.

Curabitur at ipsum ac tellus semper interdum. Mauris ullamcorper purus sit amet nulla. Quisque arcu libero, rutrum ac, lobortis vel, dapibus at, diam."""
b112c148-da95-4d21-ba42-7ddf77409e10,ed907c30-6303-478a-b9df-4c485d01bed5,condicionamiento,1.3,"""Suspendisse potenti. In eleifend quam a odio. In hac habitasse platea dictumst.

Maecenas ut massa quis augue luctus tincidunt. Nulla mollis molestie lorem. Quisque ut erat.""","""Vestibulum quam sapien, varius ut, blandit non, interdum in, ante. Vestibulum ante ipsum primis in faucibus orci luctus et ultrices posuere cubilia Curae; Duis faucibus accumsan odio. Curabitur convallis.

Duis consequat dui nec nisi volutpat eleifend. Donec ut dolor. Morbi vel lectus in quam fringilla rhoncus."""
7e4a404b-8627-4993-bfde-71bdd1745e33,705dd7e1-0544-46fb-aae3-ca255528e717,disminuir stress,1.08,"""Morbi porttitor lorem id ligula. Suspendisse ornare consequat lectus. In est risus auctor sed tristique in tempus sit amet sem.""","""Maecenas tristique, est et tempus semper, est quam pharetra magna, ac consequat metus sapien ut nunc. Vestibulum ante ipsum primis in faucibus orci luctus et ultrices posuere cubilia Curae; Mauris viverra diam vitae quam. Suspendisse potenti.

Nullam porttitor lacus at turpis. Donec posuere metus vitae ipsum. Aliquam non mauris."""
